{
    "$schema": "http://json-schema.org/draft-06/schema#",
    "$ref": "#/definitions/CoreNflTransactionsSchema",
    "definitions": {
        "CoreNflTransactionsSchema": {
            "type": "object",
            "additionalProperties": false,
            "properties": {
                "count": {
                    "type": "integer"
                },
                "pageIndex": {
                    "type": "integer"
                },
                "pageSize": {
                    "type": "integer"
                },
                "pageCount": {
                    "type": "integer"
                },
                "items": {
                    "type": "array",
                    "items": {}
                }
            },
            "required": [
                "count",
                "items",
                "pageCount",
                "pageIndex",
                "pageSize"
            ],
            "title": "CoreNflTransactionsSchema"
        }
    }
}
