{
  "count": 71,
  "pageIndex": 1,
  "pageSize": 100,
  "pageCount": 1,
  "items": [
    {
      "overOdds": 0.0,
      "underOdds": 0.0,
      "drawOdds": 0.0,
      "awayOdds": -110.0,
      "homeOdds": -106.0,
      "lineDate": "2020-10-18T11:13Z",
      "moneylineWinner": false,
      "spreadWinner": false,
      "line": 0.0
    },
    {
      "overOdds": 0.0,
      "underOdds": 0.0,
      "drawOdds": 0.0,
      "awayOdds": -112.0,
      "homeOdds": -104.0,
      "lineDate": "2020-10-19T06:12Z",
      "moneylineWinner": false,
      "spreadWinner": false,
      "line": 0.0
    },
    {
      "overOdds": 0.0,
      "underOdds": 0.0,
      "drawOdds": 0.0,
      "awayOdds": -126.0,
      "homeOdds": 108.0,
      "lineDate": "2020-10-19T06:52Z",
      "moneylineWinner": false,
      "spreadWinner": false,
      "line": 0.0
    }
  ]
}