{"count":1,"pageIndex":1,"pageSize":25,"pageCount":1,"items":[{"provider":{"id":"58","name":"ESPN BET","priority":1},"details":"TEX -160","overUnder":7.5,"spread":-1.5,"initialSpread":0.0,"initialOverUnder":0.0,"price":0.0,"overOdds":-105.0,"underOdds":-115.0,"awayTeamOdds":{"favorite":false,"underdog":true,"moneyLine":135,"open":{"favorite":false,"pointSpread":{"alternateDisplayValue":"+3.5","american":"+3.5"},"spread":{"value":1.256,"displayValue":"10/39","alternateDisplayValue":"-390","decimal":1.256,"fraction":"10/39","american":"-390"},"moneyLine":{"value":2.5,"displayValue":"3/2","alternateDisplayValue":"+150","decimal":2.5,"fraction":"3/2","american":"+150"}},"close":{"pointSpread":{"alternateDisplayValue":"+1.5","american":"+1.5"},"spread":{"value":1.625,"displayValue":"5/8","alternateDisplayValue":"-160","decimal":1.625,"fraction":"5/8","american":"-160"},"moneyLine":{"value":2.35,"displayValue":"27/20","alternateDisplayValue":"+135","decimal":2.35,"fraction":"27/20","american":"+135"}},"current":{"pointSpread":{"alternateDisplayValue":"+1.5","american":"+1.5"},"spread":{"value":1.625,"displayValue":"5/8","alternateDisplayValue":"-160","decimal":1.625,"fraction":"5/8","american":"-160","outcome":{"type":"loss"}},"moneyLine":{"value":2.35,"displayValue":"27/20","alternateDisplayValue":"+135","decimal":2.35,"fraction":"27/20","american":"+135","outcome":{"type":"loss"}}},"team":{"$ref":"http://sports.core.api.espn.com/v2/sports/baseball/leagues/mlb/seasons/2025/teams/24?lang=en&region=us"}},"homeTeamOdds":{"favorite":true,"underdog":false,"moneyLine":-160,"open":{"favorite":true,"pointSpread":{"value":3.6,"displayValue":"13/5","alternateDisplayValue":"-3.5","decimal":3.6,"fraction":"13/5","american":"-3.5"},"spread":{"value":3.6,"displayValue":"13/5","alternateDisplayValue":"+260","decimal":3.6,"fraction":"13/5","american":"+260"},"moneyLine":{"value":1.556,"displayValue":"5/9","alternateDisplayValue":"-180","decimal":1.556,"fraction":"5/9","american":"-180"}},"close":{"pointSpread":{"value":0.0,"alternateDisplayValue":"-1.5","decimal":0.0,"american":"-1.5"},"spread":{"value":2.35,"displayValue":"27/20","alternateDisplayValue":"+135","decimal":2.35,"fraction":"27/20","american":"+135"},"moneyLine":{"value":1.625,"displayValue":"5/8","alternateDisplayValue":"-160","decimal":1.625,"fraction":"5/8","american":"-160"}},"current":{"pointSpread":{"value":0.0,"alternateDisplayValue":"-1.5","decimal":0.0,"american":"-1.5"},"spread":{"value":2.35,"displayValue":"27/20","alternateDisplayValue":"+135","decimal":2.35,"fraction":"27/20","american":"+135","outcome":{"type":"win"}},"moneyLine":{"value":1.625,"displayValue":"5/8","alternateDisplayValue":"-160","decimal":1.625,"fraction":"5/8","american":"-160","outcome":{"type":"win"}}},"team":{"$ref":"http://sports.core.api.espn.com/v2/sports/baseball/leagues/mlb/seasons/2025/teams/13?lang=en&region=us"}},"links":[{"language":"en-US","rel":["home","desktop","bets"],"href":"https://espnbet.app.link/integrations?%243p=a_espn&clr=espnbettingintegration&$canonical_url=/sport/baseball/organization/united-states/competition/mlb/event/15798e35-2be2-45e2-967d-6a6367119fdf&market_selection_id[0]=5f4596a6-95a4-4493-b42c-639839ebcbbb&odds_numerator[0]=13&odds_denominator[0]=8","text":"Home Bet","shortText":"Home Bet","isExternal":true,"isPremium":false},{"language":"en-US","rel":["away","desktop","bets"],"href":"https://espnbet.app.link/integrations?%243p=a_espn&clr=espnbettingintegration&$canonical_url=/sport/baseball/organization/united-states/competition/mlb/event/15798e35-2be2-45e2-967d-6a6367119fdf&market_selection_id[0]=fb2c0989-4fd8-4b0b-9c98-55f2b7788986&odds_numerator[0]=47&odds_denominator[0]=20","text":"Away Bet","shortText":"Away Bet","isExternal":true,"isPremium":false},{"language":"en-US","rel":["homeSpread","desktop","bets"],"href":"https://espnbet.app.link/integrations?%243p=a_espn&clr=espnbettingintegration&$canonical_url=/sport/baseball/organization/united-states/competition/mlb/event/15798e35-2be2-45e2-967d-6a6367119fdf&market_selection_id[0]=a0c63a92-62d4-4f18-9439-ff619ebe3542&odds_numerator[0]=47&odds_denominator[0]=20","text":"Home Point Spread","shortText":"Home Point Spread","isExternal":true,"isPremium":false},{"language":"en-US","rel":["awaySpread","desktop","bets"],"href":"https://espnbet.app.link/integrations?%243p=a_espn&clr=espnbettingintegration&$canonical_url=/sport/baseball/organization/united-states/competition/mlb/event/15798e35-2be2-45e2-967d-6a6367119fdf&market_selection_id[0]=e844b7c2-4718-47a9-9e19-a1527b58b7d4&odds_numerator[0]=13&odds_denominator[0]=8","text":"Away Point Spread","shortText":"Away Point Spread","isExternal":true,"isPremium":false},{"language":"en-US","rel":["over","desktop","bets"],"href":"https://espnbet.app.link/integrations?%243p=a_espn&clr=espnbettingintegration&$canonical_url=/sport/baseball/organization/united-states/competition/mlb/event/15798e35-2be2-45e2-967d-6a6367119fdf&market_selection_id[0]=091e10b9-0588-443e-acac-83b33f498ff6&odds_numerator[0]=41&odds_denominator[0]=21","text":"Over Odds","shortText":"Over Odds","isExternal":true,"isPremium":false},{"language":"en-US","rel":["under","desktop","bets"],"href":"https://espnbet.app.link/integrations?%243p=a_espn&clr=espnbettingintegration&$canonical_url=/sport/baseball/organization/united-states/competition/mlb/event/15798e35-2be2-45e2-967d-6a6367119fdf&market_selection_id[0]=e74ddeb2-167c-43b6-aa72-28143936ff5c&odds_numerator[0]=43&odds_denominator[0]=23","text":"Under Odds","shortText":"Under Odds","isExternal":true,"isPremium":false},{"language":"en-US","rel":["game","desktop","bets"],"href":"https://espnbet.app.link/integrations?%243p=a_espn&clr=espnbettingintegration&$canonical_url=/sport/baseball/organization/united-states/competition/mlb/event/15798e35-2be2-45e2-967d-6a6367119fdf","text":"Game","shortText":"Game","isExternal":true,"isPremium":false}],"moneylineWinner":false,"spreadWinner":false,"open":{"over":{"value":1.952,"displayValue":"20/21","alternateDisplayValue":"-105","decimal":1.952,"fraction":"20/21","american":"-105"},"under":{"value":1.87,"displayValue":"20/23","alternateDisplayValue":"-115","decimal":1.87,"fraction":"20/23","american":"-115"},"total":{"value":1.952,"displayValue":"20/21","alternateDisplayValue":"7.5","decimal":1.952,"fraction":"20/21","american":"7.5"}},"close":{"over":{"value":1.952,"displayValue":"20/21","alternateDisplayValue":"-105","decimal":1.952,"fraction":"20/21","american":"-105"},"under":{"value":1.87,"displayValue":"20/23","alternateDisplayValue":"-115","decimal":1.87,"fraction":"20/23","american":"-115"},"total":{"value":0.0,"alternateDisplayValue":"7.5","decimal":0.0,"american":"7.5"}},"current":{"over":{"value":1.952,"displayValue":"20/21","alternateDisplayValue":"-105","decimal":1.952,"fraction":"20/21","american":"-105","outcome":{"type":"win"}},"under":{"value":1.87,"displayValue":"20/23","alternateDisplayValue":"-115","decimal":1.87,"fraction":"20/23","american":"-115","outcome":{"type":"loss"}},"total":{"value":0.0,"alternateDisplayValue":"7.5","decimal":0.0,"american":"7.5"}},"propBets":{"$ref":"http://sports.core.api.espn.com/v2/sports/baseball/leagues/mlb/events/401695789/competitions/401695789/odds/58/propBets?lang=en&region=us"}}]}