{
  "count": 5,
  "pageIndex": 1,
  "pageSize": 25,
  "pageCount": 1,
  "items": [
    {
      "rank": 1,
      "value": 91.999,
      "displayValue": "92.0",
      "total": "OVER",
      "predictorCompetition": {
        "$ref": "http://sports.core.api.espn.com/v2/sports/football/leagues/nfl/events/401326317/competitions/401326317?lang=en&region=us"
      },
      "projectedWinner": {
        "$ref": "http://sports.core.api.espn.com/v2/sports/football/leagues/nfl/seasons/2021/teams/2?lang=en&region=us"
      },
      "cover": {
        "$ref": "http://sports.core.api.espn.com/v2/sports/football/leagues/nfl/seasons/2021/teams/2?lang=en&region=us"
      },
      "projectedCover": {
        "$ref": "http://sports.core.api.espn.com/v2/sports/football/leagues/nfl/seasons/2021/teams/25?lang=en&region=us"
      }
    },
    {
      "rank": 2,
      "value": 91.629,
      "displayValue": "91.6",
      "total": "OVER",
      "predictorCompetition": {
        "$ref": "http://sports.core.api.espn.com/v2/sports/football/leagues/nfl/events/401326317/competitions/401326317?lang=en&region=us"
      },
      "projectedWinner": {
        "$ref": "http://sports.core.api.espn.com/v2/sports/football/leagues/nfl/seasons/2021/teams/1?lang=en&region=us"
      },
      "cover": {
        "$ref": "http://sports.core.api.espn.com/v2/sports/football/leagues/nfl/seasons/2021/teams/1?lang=en&region=us"
      },
      "projectedCover": {
        "$ref": "http://sports.core.api.espn.com/v2/sports/football/leagues/nfl/seasons/2021/teams/8?lang=en&region=us"
      }
    },
    {
      "rank": 3,
      "value": 91.164,
      "displayValue": "91.2",
      "total": "OVER",
      "predictorCompetition": {
        "$ref": "http://sports.core.api.espn.com/v2/sports/football/leagues/nfl/events/401326317/competitions/401326317?lang=en&region=us"
      },
      "projectedWinner": {
        "$ref": "http://sports.core.api.espn.com/v2/sports/football/leagues/nfl/seasons/2021/teams/19?lang=en&region=us"
      },
      "cover": {
        "$ref": "http://sports.core.api.espn.com/v2/sports/football/leagues/nfl/seasons/2021/teams/19?lang=en&region=us"
      },
      "projectedCover": {
        "$ref": "http://sports.core.api.espn.com/v2/sports/football/leagues/nfl/seasons/2021/teams/25?lang=en&region=us"
      }
    },
    {
      "rank": 4,
      "value": 91.07,
      "displayValue": "91.1",
      "total": "UNDER",
      "predictorCompetition": {
        "$ref": "http://sports.core.api.espn.com/v2/sports/football/leagues/nfl/events/401326317/competitions/401326317?lang=en&region=us"
      },
      "projectedWinner": {
        "$ref": "http://sports.core.api.espn.com/v2/sports/football/leagues/nfl/seasons/2021/teams/22?lang=en&region=us"
      },
      "cover": {
        "$ref": "http://sports.core.api.espn.com/v2/sports/football/leagues/nfl/seasons/2021/teams/22?lang=en&region=us"
      },
      "projectedCover": {
        "$ref": "http://sports.core.api.espn.com/v2/sports/football/leagues/nfl/seasons/2021/teams/8?lang=en&region=us"
      }
    },
    {
      "rank": 5,
      "value": 90.957,
      "displayValue": "91.0",
      "total": "UNDER",
      "predictorCompetition": {
        "$ref": "http://sports.core.api.espn.com/v2/sports/football/leagues/nfl/events/401326317/competitions/401326317?lang=en&region=us"
      },
      "projectedWinner": {
        "$ref": "http://sports.core.api.espn.com/v2/sports/football/leagues/nfl/seasons/2021/teams/22?lang=en&region=us"
      },
      "cover": {
        "$ref": "http://sports.core.api.espn.com/v2/sports/football/leagues/nfl/seasons/2021/teams/22?lang=en&region=us"
      },
      "projectedCover": {
        "$ref": "http://sports.core.api.espn.com/v2/sports/football/leagues/nfl/seasons/2021/teams/25?lang=en&region=us"
      }
    }
  ]
}