{"count":10,"pageIndex":1,"pageSize":25,"pageCount":1,"items":[{"abbreviation":"ML","displayName":"Money Line Overall Record","shortDisplayName":"Money Line","type":"moneyLineOverall","stats":[{"displayName":"Wins","abbreviation":"W","type":"win","value":16.0,"displayValue":"16"},{"displayName":"Losses","abbreviation":"L","type":"loss","value":3.0,"displayValue":"3"},{"displayName":"Ties","abbreviation":"T","type":"push","value":0.0,"displayValue":"0"},{"displayName":"Over Total","abbreviation":"Over","type":"overTotal","value":0.0,"displayValue":"0"},{"displayName":"Under Total","abbreviation":"Under","type":"underTotal","value":0.0,"displayValue":"0"},{"displayName":"Margin","abbreviation":"Margin","type":"margin","value":7.21,"displayValue":"7.210"}]},{"abbreviation":"ML HOME","displayName":"Money Line Home Record","shortDisplayName":"Money Line Home","type":"moneyLineHome","stats":[{"displayName":"Wins","abbreviation":"W","type":"win","value":9.0,"displayValue":"9"},{"displayName":"Losses","abbreviation":"L","type":"loss","value":1.0,"displayValue":"1"},{"displayName":"Ties","abbreviation":"T","type":"push","value":0.0,"displayValue":"0"},{"displayName":"Over Total","abbreviation":"Over","type":"overTotal","value":0.0,"displayValue":"0"},{"displayName":"Under Total","abbreviation":"Under","type":"underTotal","value":0.0,"displayValue":"0"},{"displayName":"Margin","abbreviation":"Margin","type":"margin","value":5.6,"displayValue":"5.600"}]},{"abbreviation":"ML AWAY","displayName":"Money Line Away Record","shortDisplayName":"Money Line Away","type":"moneyLineAway","stats":[{"displayName":"Wins","abbreviation":"W","type":"win","value":7.0,"displayValue":"7"},{"displayName":"Losses","abbreviation":"L","type":"loss","value":2.0,"displayValue":"2"},{"displayName":"Ties","abbreviation":"T","type":"push","value":0.0,"displayValue":"0"},{"displayName":"Over Total","abbreviation":"Over","type":"overTotal","value":0.0,"displayValue":"0"},{"displayName":"Under Total","abbreviation":"Under","type":"underTotal","value":0.0,"displayValue":"0"},{"displayName":"Margin","abbreviation":"Margin","type":"margin","value":9.0,"displayValue":"9.000"}]},{"abbreviation":"ML UND","displayName":"Money Line Record as Underdog","shortDisplayName":"Money Line Underdog","type":"moneyLineUnderdog","stats":[{"displayName":"Wins","abbreviation":"W","type":"win","value":1.0,"displayValue":"1"},{"displayName":"Losses","abbreviation":"L","type":"loss","value":1.0,"displayValue":"1"},{"displayName":"Ties","abbreviation":"T","type":"push","value":0.0,"displayValue":"0"},{"displayName":"Over Total","abbreviation":"Over","type":"overTotal","value":0.0,"displayValue":"0"},{"displayName":"Under Total","abbreviation":"Under","type":"underTotal","value":0.0,"displayValue":"0"},{"displayName":"Margin","abbreviation":"Margin","type":"margin","value":3.0,"displayValue":"3.000"}]},{"abbreviation":"ML FAV","displayName":"Money Line Record as Favorite","shortDisplayName":"Money Line Favorite","type":"moneyLineFavorite","stats":[{"displayName":"Wins","abbreviation":"W","type":"win","value":15.0,"displayValue":"15"},{"displayName":"Losses","abbreviation":"L","type":"loss","value":2.0,"displayValue":"2"},{"displayName":"Ties","abbreviation":"T","type":"push","value":0.0,"displayValue":"0"},{"displayName":"Over Total","abbreviation":"Over","type":"overTotal","value":0.0,"displayValue":"0"},{"displayName":"Under Total","abbreviation":"Under","type":"underTotal","value":0.0,"displayValue":"0"},{"displayName":"Margin","abbreviation":"Margin","type":"margin","value":7.71,"displayValue":"7.710"}]},{"abbreviation":"ATS","displayName":"Spread Overall Record","shortDisplayName":"Spread Overall","type":"spreadOverall","stats":[{"displayName":"Wins","abbreviation":"W","type":"win","value":7.0,"displayValue":"7"},{"displayName":"Losses","abbreviation":"L","type":"loss","value":11.0,"displayValue":"11"},{"displayName":"Ties","abbreviation":"T","type":"push","value":1.0,"displayValue":"1"},{"displayName":"Over Total","abbreviation":"Over","type":"overTotal","value":0.0,"displayValue":"0"},{"displayName":"Under Total","abbreviation":"Under","type":"underTotal","value":0.0,"displayValue":"0"},{"displayName":"Margin","abbreviation":"Margin","type":"margin","value":0.37,"displayValue":"0.370"}]},{"abbreviation":"ATS HOME","displayName":"Spread Home Record","shortDisplayName":"Spread Home","type":"spreadHome","stats":[{"displayName":"Wins","abbreviation":"W","type":"win","value":3.0,"displayValue":"3"},{"displayName":"Losses","abbreviation":"L","type":"loss","value":6.0,"displayValue":"6"},{"displayName":"Ties","abbreviation":"T","type":"push","value":1.0,"displayValue":"1"},{"displayName":"Over Total","abbreviation":"Over","type":"overTotal","value":0.0,"displayValue":"0"},{"displayName":"Under Total","abbreviation":"Under","type":"underTotal","value":0.0,"displayValue":"0"},{"displayName":"Margin","abbreviation":"Margin","type":"margin","value":-2.6,"displayValue":"-2.600"}]},{"abbreviation":"ATS AWAY","displayName":"Spread Away Record","shortDisplayName":"Spread Away","type":"spreadAway","stats":[{"displayName":"Wins","abbreviation":"W","type":"win","value":4.0,"displayValue":"4"},{"displayName":"Losses","abbreviation":"L","type":"loss","value":5.0,"displayValue":"5"},{"displayName":"Ties","abbreviation":"T","type":"push","value":0.0,"displayValue":"0"},{"displayName":"Over Total","abbreviation":"Over","type":"overTotal","value":0.0,"displayValue":"0"},{"displayName":"Under Total","abbreviation":"Under","type":"underTotal","value":0.0,"displayValue":"0"},{"displayName":"Margin","abbreviation":"Margin","type":"margin","value":3.67,"displayValue":"3.670"}]},{"abbreviation":"ATS UND","displayName":"Spread Record as Underdog","shortDisplayName":"Spread Underdog","type":"spreadUnderdog","stats":[{"displayName":"Wins","abbreviation":"W","type":"win","value":1.0,"displayValue":"1"},{"displayName":"Losses","abbreviation":"L","type":"loss","value":1.0,"displayValue":"1"},{"displayName":"Ties","abbreviation":"T","type":"push","value":0.0,"displayValue":"0"},{"displayName":"Over Total","abbreviation":"Over","type":"overTotal","value":0.0,"displayValue":"0"},{"displayName":"Under Total","abbreviation":"Under","type":"underTotal","value":0.0,"displayValue":"0"},{"displayName":"Margin","abbreviation":"Margin","type":"margin","value":5.25,"displayValue":"5.250"}]},{"abbreviation":"ATS FAV","displayName":"Spread Record as Favorite","shortDisplayName":"Spread Favorite","type":"spreadFavorite","stats":[{"displayName":"Wins","abbreviation":"W","type":"win","value":6.0,"displayValue":"6"},{"displayName":"Losses","abbreviation":"L","type":"loss","value":10.0,"displayValue":"10"},{"displayName":"Ties","abbreviation":"T","type":"push","value":1.0,"displayValue":"1"},{"displayName":"Over Total","abbreviation":"Over","type":"overTotal","value":0.0,"displayValue":"0"},{"displayName":"Under Total","abbreviation":"Under","type":"underTotal","value":0.0,"displayValue":"0"},{"displayName":"Margin","abbreviation":"Margin","type":"margin","value":-0.21,"displayValue":"-0.210"}]}]}