{"count":4,"pageIndex":1,"pageSize":25,"pageCount":1,"items":[{"$ref":"http://sports.core.api.espn.com/v2/sports/football/leagues/nfl/seasons/2023/types/2/groups/7/standings/0?lang=en&region=us","id":"0","name":"overall","displayName":"Standings","links":[{"language":"en-US","rel":["standings","desktop"],"href":"https://www.espn.com/nfl/standings/_/group/7","text":"Table","shortText":"Standings","isExternal":false,"isPremium":false}]},{"$ref":"http://sports.core.api.espn.com/v2/sports/football/leagues/nfl/seasons/2023/types/2/groups/7/standings/1?lang=en&region=us","id":"1","name":"playoff","displayName":"Playoff Standings","links":[{"language":"en-US","rel":["standings","desktop"],"href":"https://www.espn.com/nfl/standings/_/group/7","text":"Table","shortText":"Standings","isExternal":false,"isPremium":false}]},{"$ref":"http://sports.core.api.espn.com/v2/sports/football/leagues/nfl/seasons/2023/types/2/groups/7/standings/2?lang=en&region=us","id":"2","name":"expanded","displayName":"Expanded Standings","links":[{"language":"en-US","rel":["standings","desktop"],"href":"https://www.espn.com/nfl/standings/_/group/7","text":"Table","shortText":"Standings","isExternal":false,"isPremium":false}]},{"$ref":"http://sports.core.api.espn.com/v2/sports/football/leagues/nfl/seasons/2023/types/2/groups/7/standings/3?lang=en&region=us","id":"3","name":"division","displayName":"Vs. Division Standings","links":[{"language":"en-US","rel":["standings","desktop"],"href":"https://www.espn.com/nfl/standings/_/group/7","text":"Table","shortText":"Standings","isExternal":false,"isPremium":false}]}]}