{
  "count": 1,
  "pageIndex": 1,
  "pageSize": 25,
  "pageCount": 1,
  "items": [
    {
      "id": "966161",
      "type": "news",
      "date": "2025-06-01T21:12Z",
      "headline": "Bellinger is out of the lineup for Sunday's game against the Dodgers.",
      "text": "Bellinger had started in each of the Yankees' last seven games, but he went just 6-for-27 (.222 average) during that stretch and now finds himself on the bench Sunday. With Bellinger sitting, the Yankees will roll out a starting outfield of Jasson Dominguez, Trent Grisham and Aaron Judge from left to right.",
      "source": "RotoWire"
    }
  ]
}