{"count":1,"pageIndex":1,"pageSize":25,"pageCount":1,"items":[{"provider":{"id":"58","name":"ESPN BET","priority":1},"details":"DET -215","overUnder":8.5,"spread":1.5,"initialSpread":0.0,"initialOverUnder":0.0,"price":0.0,"overOdds":-105.0,"underOdds":-115.0,"awayTeamOdds":{"favorite":true,"underdog":false,"moneyLine":-215,"open":{"favorite":true,"pointSpread":{"alternateDisplayValue":"-2.5","american":"-2.5"},"spread":{"value":2.25,"displayValue":"5/4","alternateDisplayValue":"+125","decimal":2.25,"fraction":"5/4","american":"+125"},"moneyLine":{"value":1.465,"displayValue":"20/43","alternateDisplayValue":"-215","decimal":1.465,"fraction":"20/43","american":"-215"}},"close":{"pointSpread":{"alternateDisplayValue":"EVEN","american":"EVEN"}},"current":{"pointSpread":{"alternateDisplayValue":"-1.5","american":"-1.5"},"spread":{"value":1.769,"displayValue":"10/13","alternateDisplayValue":"-130","decimal":1.769,"fraction":"10/13","american":"-130","outcome":{"type":"pending"}},"moneyLine":{"value":1.465,"displayValue":"20/43","alternateDisplayValue":"-215","decimal":1.465,"fraction":"20/43","american":"-215","outcome":{"type":"pending"}}},"team":{"$ref":"http://sports.core.api.espn.com/v2/sports/baseball/leagues/mlb/seasons/2025/teams/6?lang=en&region=us"}},"homeTeamOdds":{"favorite":false,"underdog":true,"moneyLine":180,"open":{"favorite":false,"pointSpread":{"value":1.667,"displayValue":"2/3","alternateDisplayValue":"+2.5","decimal":1.667,"fraction":"2/3","american":"+2.5"},"spread":{"value":1.667,"displayValue":"2/3","alternateDisplayValue":"-150","decimal":1.667,"fraction":"2/3","american":"-150"},"moneyLine":{"value":2.8,"displayValue":"9/5","alternateDisplayValue":"+180","decimal":2.8,"fraction":"9/5","american":"+180"}},"close":{"pointSpread":{"value":0.0,"alternateDisplayValue":"EVEN","decimal":0.0,"american":"EVEN"}},"current":{"pointSpread":{"value":0.0,"alternateDisplayValue":"+1.5","decimal":0.0,"american":"+1.5"},"spread":{"value":2.1,"displayValue":"11/10","alternateDisplayValue":"+110","decimal":2.1,"fraction":"11/10","american":"+110","outcome":{"type":"pending"}},"moneyLine":{"value":2.8,"displayValue":"9/5","alternateDisplayValue":"+180","decimal":2.8,"fraction":"9/5","american":"+180","outcome":{"type":"pending"}}},"team":{"$ref":"http://sports.core.api.espn.com/v2/sports/baseball/leagues/mlb/seasons/2025/teams/4?lang=en&region=us"}},"links":[{"language":"en-US","rel":["home","desktop","bets"],"href":"https://espnbet.app.link/integrations?%243p=a_espn&clr=espnbettingintegration&$canonical_url=/sport/baseball/organization/united-states/competition/mlb/event/a15fbe1a-6c11-4b5c-8a6c-19ef99d6fab1&market_selection_id[0]=153f2f45-0ac8-41dc-a39d-947f6bff992a&odds_numerator[0]=14&odds_denominator[0]=5","text":"Home Bet","shortText":"Home Bet","isExternal":true,"isPremium":false},{"language":"en-US","rel":["away","desktop","bets"],"href":"https://espnbet.app.link/integrations?%243p=a_espn&clr=espnbettingintegration&$canonical_url=/sport/baseball/organization/united-states/competition/mlb/event/a15fbe1a-6c11-4b5c-8a6c-19ef99d6fab1&market_selection_id[0]=54570294-cefa-4bc9-ad07-87b4089cd2f5&odds_numerator[0]=63&odds_denominator[0]=43","text":"Away Bet","shortText":"Away Bet","isExternal":true,"isPremium":false},{"language":"en-US","rel":["homeSpread","desktop","bets"],"href":"https://espnbet.app.link/integrations?%243p=a_espn&clr=espnbettingintegration&$canonical_url=/sport/baseball/organization/united-states/competition/mlb/event/a15fbe1a-6c11-4b5c-8a6c-19ef99d6fab1&market_selection_id[0]=5ed1e194-39a0-4ece-906c-4ddc42b750a6&odds_numerator[0]=21&odds_denominator[0]=10","text":"Home Point Spread","shortText":"Home Point Spread","isExternal":true,"isPremium":false},{"language":"en-US","rel":["awaySpread","desktop","bets"],"href":"https://espnbet.app.link/integrations?%243p=a_espn&clr=espnbettingintegration&$canonical_url=/sport/baseball/organization/united-states/competition/mlb/event/a15fbe1a-6c11-4b5c-8a6c-19ef99d6fab1&market_selection_id[0]=fa6ab754-2b1a-4eee-9500-82d5d2d4761d&odds_numerator[0]=23&odds_denominator[0]=13","text":"Away Point Spread","shortText":"Away Point Spread","isExternal":true,"isPremium":false},{"language":"en-US","rel":["over","desktop","bets"],"href":"https://espnbet.app.link/integrations?%243p=a_espn&clr=espnbettingintegration&$canonical_url=/sport/baseball/organization/united-states/competition/mlb/event/a15fbe1a-6c11-4b5c-8a6c-19ef99d6fab1&market_selection_id[0]=2e937a05-23e8-4fc9-bca8-b14fe61e389d&odds_numerator[0]=41&odds_denominator[0]=21","text":"Over Odds","shortText":"Over Odds","isExternal":true,"isPremium":false},{"language":"en-US","rel":["under","desktop","bets"],"href":"https://espnbet.app.link/integrations?%243p=a_espn&clr=espnbettingintegration&$canonical_url=/sport/baseball/organization/united-states/competition/mlb/event/a15fbe1a-6c11-4b5c-8a6c-19ef99d6fab1&market_selection_id[0]=4cd35b56-81e1-440e-a694-d4dc6243021a&odds_numerator[0]=43&odds_denominator[0]=23","text":"Under Odds","shortText":"Under Odds","isExternal":true,"isPremium":false},{"language":"en-US","rel":["game","desktop","bets"],"href":"https://espnbet.app.link/integrations?%243p=a_espn&clr=espnbettingintegration&$canonical_url=/sport/baseball/organization/united-states/competition/mlb/event/a15fbe1a-6c11-4b5c-8a6c-19ef99d6fab1","text":"Game","shortText":"Game","isExternal":true,"isPremium":false}],"moneylineWinner":false,"spreadWinner":false,"open":{"under":{"value":2.2,"displayValue":"6/5","alternateDisplayValue":"+120","decimal":2.2,"fraction":"6/5","american":"+120"},"total":{"value":0.0,"alternateDisplayValue":"6.5","decimal":0.0,"american":"6.5"}},"current":{"over":{"value":1.952,"displayValue":"20/21","alternateDisplayValue":"-105","decimal":1.952,"fraction":"20/21","american":"-105","outcome":{"type":"pending"}},"under":{"value":1.87,"displayValue":"20/23","alternateDisplayValue":"-115","decimal":1.87,"fraction":"20/23","american":"-115","outcome":{"type":"pending"}},"total":{"value":0.0,"alternateDisplayValue":"8.5","decimal":0.0,"american":"8.5"}},"propBets":{"$ref":"http://sports.core.api.espn.com/v2/sports/baseball/leagues/mlb/events/401695838/competitions/401695838/odds/58/propBets?lang=en&region=us"}}]}