{
  "count": 4,
  "pageIndex": 1,
  "pageSize": 25,
  "pageCount": 1,
  "items": [
    {
      "$ref": "http://sports.core.api.espn.com/v2/sports/football/leagues/nfl/events/401437954/competitions/401437954/competitors/30/linescores/1/1?lang=en&region=us",
      "value": 0.0,
      "displayValue": "0",
      "source": {
        "id": "1",
        "description": "Basic/Manual"
      },
      "period": 1
    },
    {
      "$ref": "http://sports.core.api.espn.com/v2/sports/football/leagues/nfl/events/401437954/competitions/401437954/competitors/30/linescores/1/2?lang=en&region=us",
      "value": 7.0,
      "displayValue": "7",
      "source": {
        "id": "1",
        "description": "Basic/Manual"
      },
      "period": 2
    },
    {
      "$ref": "http://sports.core.api.espn.com/v2/sports/football/leagues/nfl/events/401437954/competitions/401437954/competitors/30/linescores/1/3?lang=en&region=us",
      "value": 3.0,
      "displayValue": "3",
      "source": {
        "id": "1",
        "description": "Basic/Manual"
      },
      "period": 3
    },
    {
      "$ref": "http://sports.core.api.espn.com/v2/sports/football/leagues/nfl/events/401437954/competitions/401437954/competitors/30/linescores/1/4?lang=en&region=us",
      "value": 10.0,
      "displayValue": "10",
      "source": {
        "id": "1",
        "description": "Basic/Manual"
      },
      "period": 4
    }
  ]
}