{"count":3,"pageIndex":1,"pageSize":25,"pageCount":1,"items":[{"$ref":"http://sports.core.api.espn.com/v2/sports/football/leagues/nfl/events/401547417/competitions/401547417/competitors/9/records/369?lang=en&region=us","id":"369","name":"overall","abbreviation":"Game","displayName":"Record Year To Date","shortDisplayName":"YTD","description":"Overall Record","type":"total","summary":"1-1","displayValue":"1-1","value":0.5,"stats":[{"name":"OTLosses","displayName":"Overtime Losses","shortDisplayName":"OTL","description":"Number of Overtime Losses","abbreviation":"OTL","type":"otlosses","value":0.0,"displayValue":"0"},{"name":"OTWins","displayName":"Overtime Wins","shortDisplayName":"OT Wins","description":"Number of Overtime Wins","abbreviation":"OTW","type":"otwins","value":0.0,"displayValue":"0"},{"name":"avgPointsAgainst","displayName":"Opponent Points Per Game","shortDisplayName":"OPTS/G","description":"Opponent Points Per Game","abbreviation":"OPTS/G","type":"avgpointsagainst","value":12.5,"displayValue":"12.5"},{"name":"avgPointsFor","displayName":"Points Per Game","shortDisplayName":"PTS/G","description":"Points Per Game","abbreviation":"PTS/G","type":"avgpointsfor","value":12.0,"displayValue":"12.0"},{"name":"differential","displayName":"Point Differential","shortDisplayName":"DIFF","description":"Point Differential","abbreviation":"DIFF","type":"differential","value":-1.0,"displayValue":"-1"},{"name":"divisionWinPercent","displayName":"Division Win Percentage","shortDisplayName":"DPCT","description":"Division Winning Percentage","abbreviation":"DPCT","type":"divisionwinpercent","value":1.0,"displayValue":"1.000"},{"name":"gamesBehind","displayName":"Games Back","shortDisplayName":"GB","description":"Games Back","abbreviation":"GB","type":"gamesbehind","value":0.0,"displayValue":"-"},{"name":"gamesPlayed","displayName":"Games Played","shortDisplayName":"GP","description":"Games Played","abbreviation":"GP","type":"gamesplayed","value":2.0,"displayValue":"2"},{"name":"leagueWinPercent","displayName":"League Win Percentage","shortDisplayName":"LPCT","description":"League Winning Percentage","abbreviation":"LPCT","type":"leaguewinpercent","value":0.5,"displayValue":"0.500"},{"name":"losses","displayName":"Losses","shortDisplayName":"L","description":"Losses","abbreviation":"L","type":"losses","value":1.0,"displayValue":"1"},{"name":"playoffSeed","displayName":"Position","shortDisplayName":"POS","description":"Playoff Seed","abbreviation":"SEED","type":"playoffseed","value":4.0,"displayValue":"4"},{"name":"pointDifferential","displayName":"Point Differential","shortDisplayName":"DIFF","description":"Point Differential","abbreviation":"DIFF","type":"pointdifferential","value":-1.0,"displayValue":"-1"},{"name":"points","displayName":"Points","shortDisplayName":"PTS","description":"Total Points","abbreviation":"PTS","type":"points","value":0.0,"displayValue":"0.0"},{"name":"pointsAgainst","displayName":"Points Against","shortDisplayName":"PA","description":"Total Points Against","abbreviation":"PA","type":"pointsagainst","value":25.0,"displayValue":"25"},{"name":"pointsFor","displayName":"Points For","shortDisplayName":"PF","description":"Total Points For","abbreviation":"PF","type":"pointsfor","value":24.0,"displayValue":"24"},{"name":"streak","displayName":"Streak","shortDisplayName":"STRK","description":"Current Streak","abbreviation":"STRK","type":"streak","value":-1.0,"displayValue":"L1"},{"name":"ties","displayName":"Ties","shortDisplayName":"T","description":"Ties","abbreviation":"T","type":"ties","value":0.0,"displayValue":"0"},{"name":"winPercent","displayName":"Win Percentage","shortDisplayName":"PCT","description":"Winning Percentage","abbreviation":"PCT","type":"winpercent","value":0.5,"displayValue":".500"},{"name":"wins","displayName":"Wins","shortDisplayName":"W","description":"Wins","abbreviation":"W","type":"wins","value":1.0,"displayValue":"1"},{"name":"divisionLosses","displayName":"Division Losses","shortDisplayName":"DL","description":"Division Losses","abbreviation":"DL","type":"divisionlosses","value":0.0,"displayValue":"0"},{"name":"divisionRecord","displayName":"Division record","shortDisplayName":"DIV","description":"Division Record","abbreviation":"DIV","type":"divisionrecord","value":0.0,"displayValue":"1-0"},{"name":"divisionTies","displayName":"Division Tie ","shortDisplayName":"DT","description":"Division Tie ","abbreviation":"DT","type":"divisionties","value":0.0,"displayValue":"0.000"},{"name":"divisionWins","displayName":"Division Wins ","shortDisplayName":"DW","description":"Division Winning ","abbreviation":"DW","type":"divisionwins","value":1.0,"displayValue":"1.000"}]},{"$ref":"http://sports.core.api.espn.com/v2/sports/football/leagues/nfl/events/401547417/competitions/401547417/competitors/9/records/13?lang=en&region=us","id":"13","name":"Home","displayName":"Home","shortDisplayName":"HOME","description":"Home Record","type":"home","summary":"0-0","displayValue":"0-0","stats":[{"name":"wins","displayName":"Wins","shortDisplayName":"W","description":"Wins","abbreviation":"W","type":"wins","value":0.0,"displayValue":"0"},{"name":"losses","displayName":"Losses","shortDisplayName":"L","description":"Losses","abbreviation":"L","type":"losses","value":0.0,"displayValue":"0"},{"name":"ties","displayName":"Ties","shortDisplayName":"T","description":"Ties","abbreviation":"T","type":"ties","value":0.0,"displayValue":"0"},{"name":"winPercent","displayName":"Win Percentage","shortDisplayName":"PCT","description":"Winning Percentage","abbreviation":"PCT","type":"winpercent","value":0.0,"displayValue":".000"},{"name":"OTLosses","displayName":"Overtime Losses","shortDisplayName":"OTL","description":"Number of Overtime Losses","abbreviation":"OTL","type":"otlosses","value":0.0,"displayValue":"0"}]},{"$ref":"http://sports.core.api.espn.com/v2/sports/football/leagues/nfl/events/401547417/competitions/401547417/competitors/9/records/14?lang=en&region=us","id":"14","name":"Road","displayName":"Road","shortDisplayName":"AWAY","description":"Away Record","type":"road","summary":"1-1","displayValue":"1-1","value":0.5,"stats":[{"name":"wins","displayName":"Wins","shortDisplayName":"W","description":"Wins","abbreviation":"W","type":"wins","value":1.0,"displayValue":"1"},{"name":"losses","displayName":"Losses","shortDisplayName":"L","description":"Losses","abbreviation":"L","type":"losses","value":1.0,"displayValue":"1"},{"name":"ties","displayName":"Ties","shortDisplayName":"T","description":"Ties","abbreviation":"T","type":"ties","value":0.0,"displayValue":"0"},{"name":"winPercent","displayName":"Win Percentage","shortDisplayName":"PCT","description":"Winning Percentage","abbreviation":"PCT","type":"winpercent","value":0.5,"displayValue":".500"},{"name":"OTLosses","displayName":"Overtime Losses","shortDisplayName":"OTL","description":"Number of Overtime Losses","abbreviation":"OTL","type":"otlosses","value":0.0,"displayValue":"0"}]}]}