{
  "count": 8,
  "pageIndex": 1,
  "pageSize": 25,
  "pageCount": 1,
  "items": [
    {
      "wins": 9,
      "losses": 7,
      "pushes": 1,
      "type": {
        "id": "0",
        "name": "atsOverall",
        "description": "Overall team season record against the spread"
      }
    },
    {
      "wins": 8,
      "losses": 7,
      "pushes": 1,
      "type": {
        "id": "1",
        "name": "atsFavorite",
        "description": "Team season record against the spread as the favorite"
      }
    },
    {
      "wins": 1,
      "losses": 0,
      "pushes": 0,
      "type": {
        "id": "2",
        "name": "atsUnderdog",
        "description": "Team season record against the spread as the underdog"
      }
    },
    {
      "wins": 4,
      "losses": 3,
      "pushes": 1,
      "type": {
        "id": "3",
        "name": "atsAway",
        "description": "Team season record against the spread as the away team"
      }
    },
    {
      "wins": 5,
      "losses": 4,
      "pushes": 0,
      "type": {
        "id": "4",
        "name": "atsHome",
        "description": "Team season record against the spread as the home team"
      }
    },
    {
      "wins": 3,
      "losses": 3,
      "pushes": 1,
      "type": {
        "id": "5",
        "name": "atsAwayFavorite",
        "description": "Team season record against the spread as the away favorite"
      }
    },
    {
      "wins": 1,
      "losses": 0,
      "pushes": 0,
      "type": {
        "id": "6",
        "name": "atsAwayUnderdog",
        "description": "Team season record against the spread as the away underdog"
      }
    },
    {
      "wins": 5,
      "losses": 4,
      "pushes": 0,
      "type": {
        "id": "7",
        "name": "atsHomeFavorite",
        "description": "Team season record against the spread as the home favorite"
      }
    }
  ]
}