{"count":1,"pageIndex":1,"pageSize":25,"pageCount":1,"items":[{"$ref":"http://sports.core.api.espn.com/v2/sports/soccer/leagues/eng.1/seasons/2024/types/1/standings/0?lang=en&region=us","id":"0","name":"overall","displayName":"Standings","links":[{"language":"en-US","rel":["standings","desktop"],"href":"https://www.espn.com/soccer/table/_/league/eng.1","text":"Full Table","shortText":"Standings","isExternal":false,"isPremium":false}]}]}