{"count":5,"pageIndex":1,"pageSize":25,"pageCount":1,"items":[{"rank":1,"total":"OVER","value":90.363,"displayValue":"90.4","predictorCompetition":{"$ref":"http://sports.core.api.espn.com/v2/sports/football/leagues/nfl/events/401326315/competitions/401326315?lang=en&region=us"},"projectedWinner":{"$ref":"http://sports.core.api.espn.com/v2/sports/football/leagues/nfl/seasons/2021/teams/8?lang=en&region=us"},"cover":{"$ref":"http://sports.core.api.espn.com/v2/sports/football/leagues/nfl/seasons/2021/teams/8?lang=en&region=us"},"projectedCover":{"$ref":"http://sports.core.api.espn.com/v2/sports/football/leagues/nfl/seasons/2021/teams/1?lang=en&region=us"}},{"rank":2,"total":"UNDER","value":90.246,"displayValue":"90.2","predictorCompetition":{"$ref":"http://sports.core.api.espn.com/v2/sports/football/leagues/nfl/events/401326315/competitions/401326315?lang=en&region=us"},"projectedWinner":{"$ref":"http://sports.core.api.espn.com/v2/sports/football/leagues/nfl/seasons/2021/teams/33?lang=en&region=us"},"cover":{"$ref":"http://sports.core.api.espn.com/v2/sports/football/leagues/nfl/seasons/2021/teams/33?lang=en&region=us"},"projectedCover":{"$ref":"http://sports.core.api.espn.com/v2/sports/football/leagues/nfl/seasons/2021/teams/1?lang=en&region=us"}},{"rank":3,"total":"OVER","value":89.454,"displayValue":"89.5","predictorCompetition":{"$ref":"http://sports.core.api.espn.com/v2/sports/football/leagues/nfl/events/401326315/competitions/401326315?lang=en&region=us"},"projectedWinner":{"$ref":"http://sports.core.api.espn.com/v2/sports/football/leagues/nfl/seasons/2021/teams/23?lang=en&region=us"},"cover":{"$ref":"http://sports.core.api.espn.com/v2/sports/football/leagues/nfl/seasons/2021/teams/23?lang=en&region=us"},"projectedCover":{"$ref":"http://sports.core.api.espn.com/v2/sports/football/leagues/nfl/seasons/2021/teams/1?lang=en&region=us"}},{"rank":4,"total":"UNDER","value":88.914,"displayValue":"88.9","predictorCompetition":{"$ref":"http://sports.core.api.espn.com/v2/sports/football/leagues/nfl/events/401326315/competitions/401326315?lang=en&region=us"},"projectedWinner":{"$ref":"http://sports.core.api.espn.com/v2/sports/football/leagues/nfl/seasons/2021/teams/6?lang=en&region=us"},"cover":{"$ref":"http://sports.core.api.espn.com/v2/sports/football/leagues/nfl/seasons/2021/teams/6?lang=en&region=us"},"projectedCover":{"$ref":"http://sports.core.api.espn.com/v2/sports/football/leagues/nfl/seasons/2021/teams/21?lang=en&region=us"}},{"rank":5,"total":"UNDER","value":88.869,"displayValue":"88.9","predictorCompetition":{"$ref":"http://sports.core.api.espn.com/v2/sports/football/leagues/nfl/events/401326315/competitions/401326315?lang=en&region=us"},"projectedWinner":{"$ref":"http://sports.core.api.espn.com/v2/sports/football/leagues/nfl/seasons/2021/teams/22?lang=en&region=us"},"cover":{"$ref":"http://sports.core.api.espn.com/v2/sports/football/leagues/nfl/seasons/2021/teams/25?lang=en&region=us"},"projectedCover":{"$ref":"http://sports.core.api.espn.com/v2/sports/football/leagues/nfl/seasons/2021/teams/21?lang=en&region=us"}}]}